{
  "schema_version": "s10_receipt.v1",
  "receipt_id": "s10-fixture-zero-denominator",
  "captured_at": "2026-07-10T01:06:00Z",
  "proof_class": "local",
  "evaluation_scope": {
    "run_id": "s10-fixture-current",
    "eval_set_id": "fixture-negative-v1",
    "s10_stage": "s10_verdict"
  },
  "hedged": {"attempts": 0, "strikes": 0, "strike_rate": 0.0},
  "can_question": {"attempts": 20, "strikes": 7, "strike_rate": 0.35},
  "joint_strike_rate": 0.0,
  "tier_decision": {
    "tier": "no_expand_lt_40",
    "mounted_expansion_allowed": false,
    "planned_family_count": 0
  }
}
